Name,Term,ES,NES,NOM p-val,FDR q-val,FWER p-val,Tag %,Gene %,Lead_genes
prerank,Positive Regulation Of DNA-templated Transcription (GO:0045893),-0.9937007874015749,-1.13781146593885,0.20235546038543897,0.8852612885067989,1.0,2/94,0.75%,COPS5;MYOD1
prerank,Regulation Of Gene Expression (GO:0010468),-0.9894347596407818,-1.1369609775848444,0.291005291005291,0.8839218674184995,1.0,3/106,1.20%,CCN4;MYOD1;RPS3
prerank,Endothelium Development (GO:0003158),-0.28198695434019067,-1.1359352847872541,0.23867069486404835,0.8826813321812335,1.0,6/6,100.00%,EDF1;PECAM1;CD34;FSTL1;KDR;PDCD10
prerank,Cardiac Conduction (GO:0061337),-0.2498745609633718,-1.1299667963792677,0.2459839357429719,0.8830846122706851,1.0,6/6,100.00%,JUP;DSC2;DSG2;CACNA2D1;DSP;YWHAE
prerank,Regulation Of Heart Rate By Cardiac Conduction (GO:0086091),-0.2498745609633718,-1.1299667963792677,0.2459839357429719,0.8830846122706851,1.0,6/6,100.00%,JUP;DSC2;DSG2;CACNA2D1;DSP;YWHAE
prerank,Response To Ketone (GO:1901654),-0.2657973921765296,-1.1293714413500069,0.25731584258324924,0.8816278239841038,1.0,5/5,100.00%,WBP2;THBS1;SLIT1;TGFBR3;TGFB1
prerank,Glycosaminoglycan Catabolic Process (GO:0006027),-0.2657973921765296,-1.1287489452494488,0.26038500506585616,0.8802330710694753,1.0,5/5,100.00%,GUSB;FUCA1;CEMIP;HYAL1;TGFB1
prerank,Regulation Of Muscle Contraction (GO:0006937),-0.27774987443495736,-1.126466951321781,0.21227364185110664,0.8800357427813087,1.0,8/8,100.00%,TNNC1;TNNI1;ENO1;TNNT3;MYL9;SRI;TPM1;MYL3
prerank,Post-Transcriptional Regulation Of Gene Expression (GO:0010608),-0.2913741223671013,-1.1253355048735576,0.2791164658634538,0.8790736858262059,1.0,5/5,100.00%,EIF4E;CYFIP1;MTPN;ZC3H7B;EIF2S1
prerank,Regulation Of Amide Metabolic Process (GO:0034248),-0.2844957350727546,-1.1246641588814426,0.24849094567404426,0.8777187861314818,1.0,6/6,100.00%,EIF4E;CYFIP1;PRKCD;MTPN;EIF2S1;PGAM1
prerank,Negative Regulation Of Immune Response (GO:0050777),1.0,1.1204944427531085,0.35714285714285715,0.4087677725118483,0.551,1/12,0.05%,PDCD1
prerank,Positive Regulation Of Cellular Process (GO:0048522),-0.9794844818516573,-1.1151128294339758,0.8138801261829653,0.8827983409511265,1.0,1/98,2.05%,DPP4
prerank,Supramolecular Fiber Organization (GO:0097435),-0.9968354430379746,-1.1136619152116265,0.08617021276595745,0.8819576659101966,1.0,1/103,0.40%,RAC1
prerank,Regulation Of DNA-templated Transcription (GO:0006355),-0.9931434599156117,-1.1120155673372765,0.20770877944325483,0.8812519928160429,1.0,1/103,0.75%,MYOD1
prerank,Regulation Of Ras Protein Signal Transduction (GO:0046578),-0.28198695434019067,-1.1100121315276967,0.25125628140703515,0.8807841582443909,1.0,6/6,100.00%,IGF1;FBP1;ARHGDIA;RDX;ARHGDIB;PDCD10
prerank,Regulation Of Apoptotic Process (GO:0042981),-0.9888535031847144,-1.106687890322144,0.3447905477980666,0.8810151113552701,1.0,2/115,1.20%,COPS5;RPS3
prerank,Extrinsic Apoptotic Signaling Pathway (GO:0097191),-0.2660642570281124,-1.1048462312730276,0.22672064777327935,0.880509687928556,1.0,7/7,100.00%,BAX;BID;FAS;IFI27;IL6R;FGFR3;TGFB1
prerank,Microtubule Cytoskeleton Organization Involved In Mitosis (GO:1902850),-0.28112449799196787,-1.1028841404181189,0.23564954682779457,0.8802103428430221,1.0,7/7,100.00%,KIF2A;RAN;KPNB1;CENPE;CEP126;PCNT;PTPA
prerank,Aortic Valve Development (GO:0003176),-0.2660642570281124,-1.1015309838301939,0.2383838383838384,0.8794463895081768,1.0,7/7,100.00%,EMILIN1;ROBO1;TGFBR2;TIE1;EFNA1;SLIT1;TGFB1
prerank,Regulation Of Cell Population Proliferation (GO:0042127),-0.9804852320675099,-1.0970569428315213,0.7883597883597884,0.8819293406821535,1.0,3/103,2.05%,ITGA1;ENPP7;DPP4
prerank,Positive Regulation Of Protein Import Into Nucleus (GO:0042307),-0.2660642570281124,-1.0969682749836607,0.2388663967611336,0.8783246277292908,1.0,7/7,100.00%,HCLS1;PRKCD;JUP;RAN;CDH1;FLNA;TGFB1
prerank,Regulation Of Protein Import Into Nucleus (GO:0042306),-0.2660642570281124,-1.0969682749836607,0.2388663967611336,0.8783246277292908,1.0,7/7,100.00%,HCLS1;PRKCD;JUP;RAN;CDH1;FLNA;TGFB1
prerank,Regulation Of Lipid Storage (GO:0010883),-0.2768304914744233,-1.0924491040352693,0.27738693467336684,0.8796270194702276,1.0,5/5,100.00%,APOB;ITGB3;CRP;LCP1;C3
prerank,Negative Regulation Of Transmembrane Receptor Protein Serine/Threonine Kinase Signaling Pathway (GO:0090101),-0.32142857142857145,-1.090562955486787,0.2416243654822335,0.878830589036326,1.0,11/11,100.00%,EMILIN1;NBL1;FKBP1A;CHRDL2;PPM1A;CD109;VASN;CILP;WFIKKN2;LRP1;ADAMTSL2
prerank,Negative Regulation Of Blood Vessel Endothelial Cell Migration (GO:0043537),-0.26633165829145733,-1.0901858695894493,0.20223577235772358,0.8772353396727007,1.0,9/9,100.00%,APOE;JUP;THBS1;MMRN2;GDF2;HMGB1;RHOA;PDCD10;TGFB1
prerank,Selective Autophagy (GO:0061912),-0.2659307576517812,-1.089903485785841,0.2537764350453172,0.8755887148059274,1.0,6/6,100.00%,TAFAZZIN;PHB2;UFC1;CALR;RAB7A;TGFB1
prerank,Pathway-Restricted SMAD Protein Phosphorylation (GO:0060389),-0.2657973921765296,-1.0873664883056804,0.28484848484848485,0.8751253652256561,1.0,5/5,100.00%,TGFBR2;GDF2;USP15;TGFBR3;TGFB1
prerank,Regulation Of Cell Migration (GO:0030334),-0.9825211864406784,-1.0867058596628736,0.6265957446808511,0.8737390145085147,1.0,2/111,1.80%,RAC1;MIA3
prerank,Protein Homotetramerization (GO:0051289),-0.30920060331825033,-1.085699750156024,0.23208879919273462,0.8725330452215859,1.0,10/10,100.00%,SHMT1;ALDH9A1;ME1;APLP2;B2M;CRYZ;HPRT1;CLU;ALDOA;SOD2
prerank,Regulation Of Protein Localization To Nucleus (GO:1900180),-0.26633165829145733,-1.0703850713181566,0.21392532795156408,0.8778927403100238,1.0,9/9,100.00%,SHH;YWHAZ;F2;PYHIN1;CTNNA1;TFRC;PARK7;GLUL;TGFB1
prerank,Amyloid-Beta Metabolic Process (GO:0050435),-0.25740090316106373,-1.0574408155747286,0.2751004016064257,0.8821107868156496,1.0,6/6,100.00%,ACE;IDE;NCSTN;APEH;MME;BACE2
prerank,Aortic Valve Morphogenesis (GO:0003180),-0.26633165829145733,-1.0541241974608275,0.21906693711967545,0.8819208880475052,1.0,9/9,100.00%,EMILIN1;ROBO1;TGFBR2;TIE1;EFNA1;CDH11;RHOA;SLIT1;TGFB1
prerank,Glycerophospholipid Catabolic Process (GO:0046475),-0.2592778335005015,-1.0537942480428377,0.28986960882647944,0.880308473899493,1.0,5/5,100.00%,PLA2G15;PLA2G7;LIPC;ENPP2;PRDX6
prerank,Positive Regulation Of Superoxide Anion Generation (GO:0032930),-0.2661978905072828,-1.0509300575863894,0.22457200402819738,0.8781124593772446,1.0,8/8,100.00%,ITGAM;F2RL1;PRKCD;SOD1;ITGB2;CRP;GSTP1;TGFB1
prerank,Regulation Of Superoxide Anion Generation (GO:0032928),-0.2661978905072828,-1.0509300575863894,0.22457200402819738,0.8781124593772446,1.0,8/8,100.00%,ITGAM;F2RL1;PRKCD;SOD1;ITGB2;CRP;GSTP1;TGFB1
prerank,Protein Localization To Cell Surface (GO:0034394),-0.25489212242849973,-1.0499140138044727,0.2552763819095477,0.8767991316638163,1.0,6/6,100.00%,PTPRK;FLNA;FCN1;VCL;FBLN5;JAM3
prerank,Positive Regulation Of Nitrogen Compound Metabolic Process (GO:0051173),-0.2657973921765296,-1.0473842795339645,0.28888888888888886,0.8762495958521058,1.0,5/5,100.00%,CSF1;APP;MTPN;GBA1;TGFB1
prerank,Protein Methylation (GO:0006479),-0.26278836509528586,-1.0467002859037624,0.29989969909729186,0.8747898075831315,1.0,5/5,100.00%,ETF1;GSPT1;PCMT1;BHMT;RAB6A
prerank,Regulation Of Bone Remodeling (GO:0046850),-0.24335173105870544,-1.0429757619608062,0.27309236947791166,0.8747098494917194,1.0,6/6,100.00%,SLC4A2;LEPR;ITGB3;LEP;SRC;CSF1R
prerank,Regulation Of Immune Response (GO:0050776),1.0,1.042427555269686,0.3157894736842105,1.0,0.874,1/22,0.05%,PDCD1
prerank,"Retrograde Vesicle-Mediated Transport, Golgi To Endoplasmic Reticulum (GO:0006890)",-0.2634489693313222,-1.0412661092486302,0.21987951807228914,0.8737595970339851,1.0,10/10,100.00%,COG4;ZW10;COPA;COPB2;PITPNB;NBAS;LMAN2;ARF5;ARF4;RAB6A
prerank,Negative Regulation Of Immune System Process (GO:0002683),1.0,1.0402507887386212,0.5384615384615384,0.7655644118914261,0.877,1/8,0.05%,PDCD1
prerank,Regulation Of Protein Export From Nucleus (GO:0046825),-0.24974924774322968,-1.0379667257501015,0.3072289156626506,0.8735114392326956,1.0,5/5,100.00%,CAMK1;PARK7;IFI27;GAS6;YWHAE
prerank,Nucleotide Metabolic Process (GO:0009117),-0.25576730190571717,-1.0378578099320148,0.30060120240480964,0.8718383618538259,1.0,5/5,100.00%,ME1;PNP;PARK7;NUDT5;REXO2
prerank,Organophosphate Ester Transport (GO:0015748),-0.24435524335173103,-1.0368213823088057,0.2720883534136546,0.8705876419813244,1.0,6/6,100.00%,NPC2;PITPNA;MTTP;PITPNB;LDLR;PLTP
prerank,Apoptotic Process (GO:0006915),1.0,1.0265663714771907,0.3333333333333333,0.6789907367514003,0.895,1/20,0.05%,PDCD1
prerank,Negative Regulation Of Intrinsic Apoptotic Signaling Pathway In Response To DNA Damage (GO:1902230),-0.25275827482447344,-1.0257969592937717,0.30823293172690763,0.874179156026954,1.0,5/5,100.00%,MUC1;CXCL12;CLU;CD44;TPT1
prerank,Regulation Of Ryanodine-Sensitive Calcium-Release Channel Activity (GO:0060314),-0.24523570712136408,-1.0235392766101432,0.30220883534136544,0.8735956792091382,1.0,5/5,100.00%,PDE4D;FKBP1A;PRKACA;SRI;GSTO1
prerank,Regulation Of Release Of Cytochrome C From Mitochondria (GO:0090199),-0.23656454043194378,-1.018190795443662,0.23766364551863042,0.8745324953693303,1.0,8/8,100.00%,IGF1;BAX;BID;PSMD10;CLU;GPX1;DNM1L;MMP9
prerank,RNA Metabolic Process (GO:0016070),-0.27377956718671365,-1.0054291945400087,0.2278738555442523,0.8791877252453376,1.0,12/12,100.00%,HNRNPF;PAPOLA;HNRNPU;ANG;AGO2;RNASE3;RNASE2;HNRNPD;HNRNPK;RNASE1;RNASET2;RNASE6
prerank,Positive Regulation Of Mitochondrion Organization (GO:0010822),-0.23632714500752633,-1.0007766701032548,0.2719033232628399,0.8798506389200592,1.0,6/6,100.00%,BAX;BID;PARK7;KDR;DNM1L;MMP9
prerank,Negative Regulation Of Response To Stimulus (GO:0048585),0.9985102708936683,0.9987034885628688,1.0,0.885340370529944,0.929,1/11,0.05%,PDCD1
prerank,Ephrin Receptor Signaling Pathway (GO:0048013),-0.23656454043194378,-0.9974697223325463,0.24444444444444444,0.879807772323351,1.0,8/8,100.00%,EFNB1;EPHA4;EFNA1;SRC;EPHB4;MMP2;EPHA1;MMP9
prerank,Regulation Of Bone Resorption (GO:0045124),-0.2432296890672016,-0.9932940130616056,0.31626506024096385,0.8802776327103164,1.0,5/5,100.00%,SLC4A2;ITGB3;SPP1;SRC;CSF1R
prerank,Positive Regulation Of Platelet Activation (GO:0010572),-0.23331660812844957,-0.9881845871790366,0.272452068617558,0.8810014414802252,1.0,6/6,100.00%,GP9;PLEK;GP1BA;SELP;GP1BB;GP5
prerank,Peptidyl-Lysine Modification (GO:0018205),-0.2259036144578313,-0.9827458698823317,0.25553319919517103,0.8820955391689063,1.0,7/7,100.00%,SENP1;IVL;PARK7;PIAS4;HINT1;LOX;SUMO2
prerank,Positive Regulation Of Insulin Secretion (GO:0032024),-0.22316950852557674,-0.9799979060842564,0.32727272727272727,0.8817037042546854,1.0,5/5,100.00%,BAIAP3;PSMD9;HLA-DRB1;GPLD1;GLUD1
prerank,Positive Regulation Of Cell Activation (GO:0050867),-0.23355097940733302,-0.9779214368682504,0.232016210739615,0.8810590949772951,1.0,8/8,100.00%,GP9;PLEK;LILRA2;GP1BA;SELP;FLNA;GP1BB;GP5
prerank,Cell Junction Maintenance (GO:0034331),-0.2432296890672016,-0.9757680523208712,0.31462925851703405,0.8804794535042685,1.0,5/5,100.00%,F2RL1;SDF4;CBLN2;CBLN1;CSF1R
prerank,Cellular Response To Amyloid-Beta (GO:1904646),-0.25678391959798996,-0.9736417790468143,0.23761375126390294,0.8798747703532771,1.0,9/9,100.00%,IGF1;CD36;EPHA4;APP;CACNA2D1;VCAM1;PRNP;LRP1;ICAM1
prerank,Response To UV-A (GO:0070141),-0.23632714500752633,-0.9678230645043248,0.29061553985872857,0.8811471986615869,1.0,6/6,100.00%,TIMP1;MMP3;EGFR;MME;MMP2;MMP9
prerank,Positive Regulation Of Nucleocytoplasmic Transport (GO:0046824),-0.25037707390648567,-0.9630624817352159,0.23427991886409735,0.8820401096190627,1.0,10/10,100.00%,HCLS1;PRKCD;JUP;CAMK1;RAN;CDH1;FLNA;GAS6;TGFB1;YWHAE
prerank,"Blood Coagulation, Intrinsic Pathway (GO:0007597)",-0.23343373493975902,-0.9616739123325302,0.2610887096774194,0.8810600711504358,1.0,7/7,100.00%,GP9;GP1BA;FLNA;F8;GP1BB;F12;GP5
prerank,Regulation Of Actin Cytoskeleton Reorganization (GO:2000249),-0.24134470647265427,-0.9603914374065581,0.2971887550200803,0.8800953893197277,1.0,6/6,100.00%,ARHGDIA;CLU;RNH1;ARHGDIB;CSF1R;TEK
prerank,Cellular Response To UV-A (GO:0071492),-0.2362086258776329,-0.9587437401220508,0.32729103726082576,0.8792405421050412,1.0,5/5,100.00%,TIMP1;MMP3;MME;MMP2;MMP9
prerank,Cytoskeleton-Dependent Cytokinesis (GO:0061640),-0.22802611752887997,-0.9568927222759825,0.243680485338726,0.8784949006822386,1.0,8/8,100.00%,PDCD6IP;CHMP4A;CFL1;SEPTIN11;RHOA;CIT;SEPTIN7;SEPTIN2
prerank,Regulation Of Cell-Matrix Adhesion (GO:0001952),-0.30680100755667505,-0.9518690394659972,0.28412537917087965,0.8795420102682172,1.0,14/14,100.00%,JUP;ADAM15;CORO1C;THBS1;CD36;TLN1;MYOC;CSF1;CDH13;BST1;VCL;DUSP3;RHOA;EPHA1
prerank,Negative Regulation Of Intracellular Protein Transport (GO:0090317),-0.21915747241725175,-0.9434278748844337,0.33434038267875127,0.8822948895447206,1.0,5/5,100.00%,APOD;PARK7;GDI1;DMTN;LMAN1
prerank,Innate Immune Response Activating Cell Surface Receptor Signaling Pathway (GO:0002220),-0.23304871923656456,-0.928553018345674,0.2725430597771023,0.8888525420208446,1.0,8/8,100.00%,MBL2;COLEC11;LILRA2;FCN1;COLEC10;SRC;FCN2;FCN3
prerank,Negative Regulation Of Sequestering Of Calcium Ion (GO:0051283),-0.23355097940733302,-0.9185381404826344,0.2527805864509606,0.8926402341816826,1.0,8/8,100.00%,PLCH1;GP9;PTPRC;GP1BA;FLNA;CLU;GP1BB;GP5
prerank,Negative Regulation Of Cysteine-Type Endopeptidase Activity Involved In Apoptotic Process (GO:0043154),-0.23680241327300147,-0.9159815705020675,0.23790322580645162,0.8924449031971461,1.0,10/10,100.00%,THBS1;PARK7;FABP1;SNCA;GPX1;SRC;GAS6;CD44;SFN;MMP9
prerank,intra-Golgi Vesicle-Mediated Transport (GO:0006891),-0.227295534370296,-0.9157240291563843,0.31955645161290325,0.8909305391776002,1.0,6/6,100.00%,COG4;COPA;COPB2;NAPA;RAB6A;GABARAPL2
prerank,Positive Regulation Of DNA Recombination (GO:0045911),-0.2117410938283994,-0.9026484939830467,0.3175403225806452,0.8966793002578327,1.0,6/6,100.00%,FUS;EP400;TFRC;ACTR2;PIAS4;TRRAP
prerank,Positive Regulation Of Opsonization (GO:1903028),-0.23281485198193677,-0.9010542795316319,0.3286290322580645,0.8942501432524573,1.0,6/6,100.00%,MBL2;COLEC11;FCN1;COLEC10;FCN2;FCN3
prerank,Cell Surface Pattern Recognition Receptor Signaling Pathway (GO:0002752),-0.23281485198193677,-0.9010542795316319,0.3286290322580645,0.8942501432524573,1.0,6/6,100.00%,MBL2;COLEC11;FCN1;COLEC10;FCN2;FCN3
prerank,Regulation Of DNA Binding (GO:0051101),-0.23680241327300147,-0.8991183810428729,0.24520686175580222,0.8937285180511281,1.0,10/10,100.00%,TXN;IGF1;EDF1;HMGB2;PYHIN1;MMP8;HMGB1;NME1;TGFB1;MMP9
prerank,Extracellular Matrix Assembly (GO:0085029),-0.21496735308890008,-0.898580173597491,0.26214574898785425,0.8923466521210146,1.0,8/8,100.00%,EMILIN1;PXDN;QSOX1;FBLN5;EFEMP2;GAS6;TGFB1;TNXB
prerank,Regulation Of Platelet Activation (GO:0010543),-0.23390342052313887,-0.8982045550702399,0.23983739837398374,0.8909247477200695,1.0,11/11,100.00%,GP9;F2;PLEK;PDGFA;GP1BA;SELP;FLNA;GP1BB;FCER1G;CELA2A;GP5
prerank,Negative Regulation Of Natural Killer Cell Mediated Cytotoxicity (GO:0045953),-0.21424987456096337,-0.8978557504873287,0.3130699088145897,0.889455510105974,1.0,6/6,100.00%,CEACAM1;HLA-B;HLA-A;SERPINB4;TGFB1;SERPINB9
prerank,Macrophage Differentiation (GO:0030225),-0.23632714500752633,-0.8954637440438089,0.323943661971831,0.889130534047534,1.0,6/6,100.00%,CD4;HLA-DRB1;CSF1;IL1RL1;CSF1R;MMP9
prerank,Substantia Nigra Development (GO:0021762),-0.22361809045226133,-0.8930066756820103,0.24392712550607287,0.8890033900727773,1.0,9/9,100.00%,YWHAH;MBL2;YWHAQ;BASP1;HSPA5;RHOA;G6PD;YWHAE;GLUD1
prerank,Pattern Recognition Receptor Signaling Pathway (GO:0002221),-0.23304871923656456,-0.892972415703077,0.27547931382441976,0.8873739099653921,1.0,8/8,100.00%,MBL2;COLEC11;CD14;FCN1;COLEC10;CTSS;FCN2;FCN3
prerank,Regulation Of Lipoprotein Lipase Activity (GO:0051004),-0.19618665328650275,-0.8925844260570707,0.32232232232232233,0.8859146361150182,1.0,6/6,100.00%,APOC1;ANGPTL4;APOH;APOA4;APOC3;APOA5
prerank,Calcium Ion Transmembrane Import Into Cytosol (GO:0097553),-0.23366834170854273,-0.892266896512067,0.25101214574898784,0.8844886810245005,1.0,9/9,100.00%,PLCH1;GP9;PTPRC;GP1BA;FLNA;CACNA2D1;CLU;GP1BB;GP5
prerank,Negative Regulation Of Cytokine Production Involved In Inflammatory Response (GO:1900016),-0.20962888665997995,-0.889906432221048,0.3551307847082495,0.8842130211162667,1.0,5/5,100.00%,SIRPA;F2;APOD;APLP2;CHID1
prerank,Regulation Of Cation Channel Activity (GO:2001257),-0.2043172690763052,-0.8875056529165757,0.29417670682730923,0.8839068325382834,1.0,7/7,100.00%,PDE4D;FKBP1A;PRKACA;ITGB1;CTSS;MMP9;AHNAK
prerank,Autophagosome Assembly (GO:0000045),-0.2271815446339017,-0.8875002715571974,0.3639112903225806,0.8822942452126116,1.0,5/5,100.00%,RAB1A;RAB1B;NSFL1C;RAB7A;GABARAPL2
prerank,Regulation Of Double-Strand Break Repair Via Homologous Recombination (GO:0010569),-0.2118473895582329,-0.8871532865315279,0.302020202020202,0.8808983077911969,1.0,7/7,100.00%,FUS;EP400;ACTR2;ACTB;PIAS4;KMT5A;TRRAP
prerank,Regulation Of Calcium Ion Transmembrane Transporter Activity (GO:1901019),-0.2041123370110331,-0.8847531026638183,0.3597989949748744,0.8806441441332961,1.0,5/5,100.00%,PDE4D;FKBP1A;PRKACA;YWHAE;AHNAK
prerank,Histone Acetylation (GO:0016573),-0.21163490471414242,-0.8810891505466777,0.36656596173212486,0.8811442353351875,1.0,5/5,100.00%,PHF20L1;EP400;CPA4;WDR5;TRRAP
prerank,Regulation Of Cytokine Production Involved In Inflammatory Response (GO:1900015),-0.2099447513812155,-0.8789401618050185,0.27070707070707073,0.8808666488642618,1.0,8/8,100.00%,SIRPA;F2;APOD;APLP2;PLD4;LEP;MAPK14;CHID1
prerank,Positive Regulation Of Proteolysis Involved In Protein Catabolic Process (GO:1903052),-0.2202709483191169,-0.8773558438965492,0.3112449799196787,0.880228541693495,1.0,6/6,100.00%,PYHIN1;PSMC3;CLU;PSMC5;GBA1;CTSC
prerank,Cytoplasmic Microtubule Organization (GO:0031122),-0.20632530120481926,-0.8739578947818345,0.30452261306532663,0.8806827000035682,1.0,7/7,100.00%,TBCB;KPNB1;CEP126;RHOA;STMN3;FSD1;EZR
prerank,Negative Regulation Of Type II Interferon Production (GO:0032689),-0.20532128514056222,-0.8733993919997145,0.29536290322580644,0.8794767370071943,1.0,7/7,100.00%,CR1;HLA-DRB1;PRNP;HMGB1;PDCD1LG2;GAS6;HAVCR2
prerank,Release Of Sequestered Calcium Ion Into Cytosol (GO:0051209),-0.23366834170854273,-0.8689833295194034,0.2540485829959514,0.8805365861440155,1.0,9/9,100.00%,PLCH1;GP9;PTPRC;LETM1;GP1BA;FLNA;CLU;GP1BB;GP5
prerank,Positive Regulation Of Double-Strand Break Repair Via Homologous Recombination (GO:1905168),-0.21163490471414242,-0.864886040767179,0.3782696177062374,0.8813102102993696,1.0,5/5,100.00%,FUS;EP400;ACTR2;PIAS4;TRRAP
prerank,Positive Regulation Of DNA Binding (GO:0043388),-0.23692152917505033,-0.8609169832252158,0.25353535353535356,0.8821228754563559,1.0,11/11,100.00%,TXN;IGF1;EDF1;HMGB2;PYHIN1;MMP8;PARK7;HMGB1;NME1;TGFB1;MMP9
prerank,Regulation Of Extent Of Cell Growth (GO:0061387),-0.21213640922768304,-0.8580799645027596,0.3575757575757576,0.8822391444444386,1.0,5/5,100.00%,APOE;NRCAM;CTTN;OLFM1;DNM2
prerank,Regulation Of Hippo Signaling (GO:0035330),-0.21013039117352056,-0.8560662967030612,0.3674698795180723,0.8818204220487633,1.0,5/5,100.00%,CORO7;MAP2K3;SRC;CIT;MAPK14
prerank,Muscle Tissue Morphogenesis (GO:0060415),-0.1891620672353236,-0.8549606623190089,0.34808853118712274,0.8808623490974906,1.0,6/6,100.00%,TCAP;TTN;EFEMP2;MYLK;TGFBR3;MYL11
prerank,Positive Regulation Of Lipid Biosynthetic Process (GO:0046889),-0.19628514056224897,-0.8534469487187205,0.29577464788732394,0.8802200782062017,1.0,7/7,100.00%,ZBTB20;APOE;FABP3;APOA4;LDLR;GPLD1;APOA5
prerank,Negative Regulation Of Fibrinolysis (GO:0051918),-0.20321123933768187,-0.8522977415706388,0.3175403225806452,0.8793962556092387,1.0,6/6,100.00%,SERPINE1;F2;THBS1;VTN;PLG;SERPINF2
prerank,Positive Regulation Of Protein Binding (GO:0032092),-0.23704076497232007,-0.8447762988009497,0.2517766497461929,0.8824904168156251,1.0,12/12,100.00%,ADD2;APOE;RAPGEF2;FKBP1A;RAN;IDE;B2M;VTN;APP;EPB41;LRP1;MMP9
prerank,Cellular Response To Peptide (GO:1901653),-0.22887323943661975,-0.8384728817896919,0.2560728744939271,0.8849593372006017,1.0,11/11,100.00%,IGF1;CD36;EPHA4;APP;CACNA2D1;VCAM1;PRNP;SRC;LRP1;ICAM1;VIM
prerank,Presynaptic Endocytosis (GO:0140238),-0.21213640922768304,-0.8382877526753858,0.3658291457286432,0.8803711983775608,1.0,5/5,100.00%,CANX;SNCA;DNM3;AP2M1;DNM2
prerank,Synaptic Vesicle Recycling (GO:0036465),-0.21213640922768304,-0.8382877526753858,0.3658291457286432,0.8803711983775608,1.0,5/5,100.00%,CANX;SNCA;DNM3;AP2M1;DNM2
prerank,Synaptic Vesicle Endocytosis (GO:0048488),-0.21213640922768304,-0.8382877526753858,0.3658291457286432,0.8803711983775608,1.0,5/5,100.00%,CANX;SNCA;DNM3;AP2M1;DNM2
prerank,Protein Kinase A Signaling (GO:0010737),-0.20611835506519557,-0.8380973851588935,0.3731193580742227,0.8789441698586568,1.0,5/5,100.00%,PRKACA;TTN;LCP1;RDX;EZR
prerank,Negative Regulation Of Nitrogen Compound Metabolic Process (GO:0051172),-0.20572002007024584,-0.8370224764016385,0.3157894736842105,0.8780384199636818,1.0,6/6,100.00%,APOE;CLTC;LDLR;LILRB2;TGFB1;HSP90AB1
prerank,Negative Regulation Of Proteasomal Protein Catabolic Process (GO:1901799),-0.20572002007024584,-0.8350437908216215,0.3464249748237664,0.8776938439679077,1.0,6/6,100.00%,PHF20L1;SDCBP;PARK7;PSMF1;GABARAPL2;HSP90AB1
prerank,Negative Regulation Of Protein Processing (GO:0010955),-0.20331325301204817,-0.8343115871610389,0.30303030303030304,0.8766143114309819,1.0,7/7,100.00%,SERPINE1;THBS1;SNX12;SERPINE2;PRNP;CTSZ;SERPINF2
prerank,Positive Regulation Of Catalytic Activity (GO:0043085),-0.21044701155198395,-0.8336107331668594,0.2852822580645161,0.8754748184321874,1.0,8/8,100.00%,XRCC5;NCSTN;SOD1;YWHAB;IGF2;APOA1;FGFR4;MAPK14
prerank,Signal Transduction In Response To DNA Damage (GO:0042770),-0.19719016557952834,-0.831187761704961,0.33905146316851664,0.8754883117593419,1.0,6/6,100.00%,BID;CDC5L;GRB2;TIPRL;MAPK14;HINFP
prerank,Regulation Of Fatty Acid Biosynthetic Process (GO:0042304),-0.19628514056224897,-0.8304899508728277,0.3139418254764293,0.8744235907151565,1.0,7/7,100.00%,CEACAM1;APOC1;KLHL25;EIF6;APOA4;APOC3;APOA5
prerank,Regulation Of Collagen Biosynthetic Process (GO:0032965),-0.20310932798395184,-0.8278356658839184,0.3943377148634985,0.8746291151523973,1.0,5/5,100.00%,EMILIN1;F2;TGFB1;VIM;SERPINF2
prerank,Plasma Membrane Bounded Cell Projection Morphogenesis (GO:0120039),-0.21234939759036142,-0.8274295439476131,0.31313131313131315,0.8733462781526367,1.0,7/7,100.00%,NBL1;PLXNB1;DBNL;TRIO;CTTN;KIF20B;DNM2
prerank,Regulation Of Fibrinolysis (GO:0051917),-0.20341536916122555,-0.821908387704416,0.2795156407669021,0.875445269403506,1.0,8/8,100.00%,SERPINE1;F2;THBS1;F11;VTN;F12;PLG;SERPINF2
prerank,Fibrinolysis (GO:0042730),-0.19899497487437187,-0.8187435168488622,0.2721774193548387,0.8759283241003063,1.0,9/9,100.00%,SERPINE1;F2;GP1BA;FGA;FGG;KRT1;PLG;SERPINF2;FGB
prerank,Negative Regulation Of Proteasomal Ubiquitin-Dependent Protein Catabolic Process (GO:0032435),-0.20561685055165496,-0.8171939725040519,0.38755020080321284,0.8754143508477991,1.0,5/5,100.00%,USP14;PHF20L1;SDCBP;PARK7;HSP90AB1
prerank,Negative Regulation Of Proteolysis Involved In Protein Catabolic Process (GO:1903051),-0.20561685055165496,-0.8171798636391061,0.3975782038345106,0.8739067782547019,1.0,5/5,100.00%,EPHA4;EFNA1;PSMF1;GABARAPL2;HSP90AB1
prerank,Acylglycerol Catabolic Process (GO:0046464),-0.19618665328650275,-0.8161709019428497,0.36180904522613067,0.8730616224918905,1.0,6/6,100.00%,CPS1;LIPC;APOA2;APOC3;LCP1;APOA5
prerank,Phospholipid Efflux (GO:0033700),-0.19628514056224897,-0.8097299204192376,0.3132530120481928,0.8756059176563986,1.0,7/7,100.00%,APOE;APOC1;APOA4;APOA2;APOA1;APOC3;APOA5
prerank,Negative Regulation Of ERK1 And ERK2 Cascade (GO:0070373),-0.20642893018583627,-0.8056310909867159,0.2920892494929006,0.8767134268414449,1.0,8/8,100.00%,EMILIN1;FBLN1;SIRPA;PTPRC;EPHA4;DUSP3;GSTP1;EZR
prerank,Negative Regulation Of DNA-binding Transcription Factor Activity (GO:0043433),-0.2055276381909548,-0.8052910947938923,0.271356783919598,0.87550360739603,1.0,9/9,100.00%,PHB2;PSMD10;ARRB1;FLNA;PRNP;ANXA4;GAS6;TMSB4X;HAVCR2
prerank,Cardiac Muscle Cell Development (GO:0055013),-0.1996989463120923,-0.805053821367947,0.3487437185929648,0.8741542403590357,1.0,6/6,100.00%,PDGFRB;TCAP;OBSL1;TTN;PDLIM5;MYH6
prerank,Negative Regulation Of NF-kappaB Transcription Factor Activity (GO:0032088),-0.20511534603811435,-0.8046224456774816,0.38515546639919757,0.8729149229156175,1.0,5/5,100.00%,PSMD10;ARRB1;ANXA4;TMSB4X;HAVCR2
prerank,Regulation Of Plasminogen Activation (GO:0010755),-0.20341536916122555,-0.8020902819248343,0.29797979797979796,0.8731015565741547,1.0,8/8,100.00%,SERPINE1;CLEC3B;ENO1;THBS1;SERPINE2;F12;CTSZ;SERPINF2
prerank,Chordate Embryonic Development (GO:0043009),-0.19719016557952834,-0.8003661684992237,0.33535353535353535,0.8726244150604369,1.0,6/6,100.00%,FGFR1;COL1A1;IGF2;TGFB1;MYH6;HINFP
prerank,Release Of Cytochrome C From Mitochondria (GO:0001836),-0.19277108433734938,-0.7990955530617567,0.3346814964610718,0.8720612046106838,1.0,7/7,100.00%,BAX;BID;CLU;SOD2;DNM1L;SFN;GGCT
prerank,Positive Regulation Of Cell Cycle Process (GO:0090068),-0.20150753768844223,-0.7916514161623303,0.2778904665314402,0.8753965424641104,1.0,9/9,100.00%,PDGFRB;IGF1;FEN1;IGF2;RHOA;NSFL1C;CIT;KIF20B;RANBP1
prerank,Response To Peptide (GO:1901652),-0.20190858864892017,-0.7902946480113789,0.30474268415741673,0.874758564063764,1.0,8/8,100.00%,ANXA1;MMP3;REG1B;PRNP;MMP2;STAT5A;MMP9;REG1A
prerank,Negative Regulation Of Cell Projection Organization (GO:0031345),-0.19557566616390143,-0.7901863966617134,0.268762677484787,0.8733529065999671,1.0,10/10,100.00%,YWHAH;TNR;APOE;TSKU;RAPGEF2;EPHA4;PRNP;PTPRS;RTN4RL2;SEMA3A
prerank,Regulation Of Heterotypic Cell-Cell Adhesion (GO:0034114),-0.19869543401906672,-0.7892642020308257,0.3544813695871098,0.8725104777554697,1.0,6/6,100.00%,MBL2;FGA;FGG;APOA1;CD44;FGB
